{
  "schemaVersion": "agent-eval-production-derived-authority-contract-1",
  "id": "repo-change-production-derived-authorities",
  "version": "0.1.0",
  "authorities": [
    {
      "authorityId": "production-data-provenance-authority",
      "producer": {
        "id": "fixture-data-provenance-custodian",
        "role": "data-provenance",
        "trustDomain": "external"
      }
    },
    {
      "authorityId": "production-data-owner-authority",
      "producer": {
        "id": "fixture-data-owner",
        "role": "data-owner",
        "trustDomain": "governance"
      }
    },
    {
      "authorityId": "production-privacy-authority",
      "producer": {
        "id": "fixture-privacy-verifier",
        "role": "privacy-verifier",
        "trustDomain": "case_qa"
      }
    },
    {
      "authorityId": "production-isolation-authority",
      "producer": {
        "id": "fixture-isolation-verifier",
        "role": "environment-verifier",
        "trustDomain": "runner"
      }
    }
  ],
  "proofPolicies": [
    {
      "proofKind": "production_input_provenance",
      "authorityId": "production-data-provenance-authority",
      "creationPhase": "case_qa",
      "evidenceSchemaId": "production-input-provenance-proof-1",
      "verifier": {
        "id": "repo-change-production-derived-verifier",
        "version": "0.1.0",
        "digest": "sha256:d8c1ea13cfa6fed680dfbce6f20f4cde8ea3144dc5ce295764f068d781b8a3fa"
      }
    },
    {
      "proofKind": "data_owner_authorization",
      "authorityId": "production-data-owner-authority",
      "creationPhase": "case_qa",
      "evidenceSchemaId": "production-input-authorization-proof-1",
      "verifier": {
        "id": "repo-change-production-derived-verifier",
        "version": "0.1.0",
        "digest": "sha256:d8c1ea13cfa6fed680dfbce6f20f4cde8ea3144dc5ce295764f068d781b8a3fa"
      }
    },
    {
      "proofKind": "redaction_verification",
      "authorityId": "production-privacy-authority",
      "creationPhase": "case_qa",
      "evidenceSchemaId": "production-input-redaction-proof-1",
      "verifier": {
        "id": "repo-change-production-derived-verifier",
        "version": "0.1.0",
        "digest": "sha256:d8c1ea13cfa6fed680dfbce6f20f4cde8ea3144dc5ce295764f068d781b8a3fa"
      }
    },
    {
      "proofKind": "reidentification_assessment",
      "authorityId": "production-privacy-authority",
      "creationPhase": "case_qa",
      "evidenceSchemaId": "production-input-reidentification-proof-1",
      "verifier": {
        "id": "repo-change-production-derived-verifier",
        "version": "0.1.0",
        "digest": "sha256:d8c1ea13cfa6fed680dfbce6f20f4cde8ea3144dc5ce295764f068d781b8a3fa"
      }
    },
    {
      "proofKind": "production_path_isolation",
      "authorityId": "production-isolation-authority",
      "creationPhase": "pre_run",
      "evidenceSchemaId": "production-input-isolation-proof-1",
      "verifier": {
        "id": "repo-change-production-derived-verifier",
        "version": "0.1.0",
        "digest": "sha256:d8c1ea13cfa6fed680dfbce6f20f4cde8ea3144dc5ce295764f068d781b8a3fa"
      }
    }
  ],
  "separation": {
    "independentProofKinds": [
      "data_owner_authorization",
      "redaction_verification",
      "production_path_isolation"
    ],
    "distinctProducerIds": true,
    "distinctTrustDomains": true
  },
  "digest": "sha256:a0f870fbcda7bc96680ec6ec66f4860ce7dcbaee664f6b39840076adb1a95ce2"
}
